{
  "version": "v1",
  "source": {
    "title": "Mathematics Syllabus, Primary One to Six (2021 syllabus)",
    "publisher": "Curriculum Planning and Development Division, Ministry of Education, Singapore",
    "edition": "Updated October 2025",
    "url": "https://www.moe.gov.sg/api/media/92bff26d-b2b4-4535-b868-b8415c744b91/2021-Primary-Mathematics-Syllabus-P1-to-P6-Updated-October-2025.pdf",
    "section": "Section 5: Content by Level (pp. 31-44), standard track only",
    "copyright": "Outcome text (c) 2025 Curriculum Planning and Development Division. Reproduced verbatim for personal and non-commercial use."
  },
  "topicCount": 66,
  "topics": [
    {
      "id": "P1.WN.1", "level": "P1", "strand": "Number and Algebra", "subStrand": "Whole Numbers",
      "name": "Numbers up to 100", "sourcePage": 31,
      "outcomes": [
        { "id": "P1.WN.1.1", "text": "counting to tell the number of objects in a given set" },
        { "id": "P1.WN.1.2", "text": "number notation, representations and place values (tens, ones)" },
        { "id": "P1.WN.1.3", "text": "reading and writing numbers in numerals and in words" },
        { "id": "P1.WN.1.4", "text": "comparing the number of objects in two or more sets" },
        { "id": "P1.WN.1.5", "text": "comparing and ordering numbers" },
        { "id": "P1.WN.1.6", "text": "patterns in number sequences" },
        { "id": "P1.WN.1.7", "text": "ordinal numbers (first, second, up to tenth) and symbols (1st, 2nd, 3rd, etc.)" }
      ]
    },
    {
      "id": "P1.WN.2", "level": "P1", "strand": "Number and Algebra", "subStrand": "Whole Numbers",
      "name": "Addition and Subtraction", "sourcePage": 31,
      "outcomes": [
        { "id": "P1.WN.2.1", "text": "concepts of addition and subtraction" },
        { "id": "P1.WN.2.2", "text": "use of +, – and =" },
        { "id": "P1.WN.2.3", "text": "relationship between addition and subtraction" },
        { "id": "P1.WN.2.4", "text": "adding more than two 1-digit numbers" },
        { "id": "P1.WN.2.5", "text": "adding and subtracting within 100" },
        { "id": "P1.WN.2.6", "text": "adding and subtracting using algorithms" },
        { "id": "P1.WN.2.7", "text": "mental calculation involving addition and subtraction",
          "items": ["within 20", "of a 2-digit number and ones without renaming", "of a 2-digit number and tens"] }
      ]
    },
    {
      "id": "P1.WN.3", "level": "P1", "strand": "Number and Algebra", "subStrand": "Whole Numbers",
      "name": "Multiplication and Division", "sourcePage": 31,
      "outcomes": [
        { "id": "P1.WN.3.1", "text": "concepts of multiplication and division" },
        { "id": "P1.WN.3.2", "text": "use of ×" },
        { "id": "P1.WN.3.3", "text": "multiplying within 40" },
        { "id": "P1.WN.3.4", "text": "dividing within 20" }
      ]
    },
    {
      "id": "P1.MO.1", "level": "P1", "strand": "Number and Algebra", "subStrand": "Money",
      "name": "Money", "sourcePage": 31,
      "outcomes": [
        { "id": "P1.MO.1.1", "text": "counting amount of money", "items": ["in cents up to $1", "in dollars up to $100"] }
      ]
    },
    {
      "id": "P1.ME.1", "level": "P1", "strand": "Measurement and Geometry", "subStrand": "Measurement",
      "name": "Length", "sourcePage": 32,
      "outcomes": [
        { "id": "P1.ME.1.1", "text": "measuring length in centimetres" },
        { "id": "P1.ME.1.2", "text": "use of abbreviation cm" },
        { "id": "P1.ME.1.3", "text": "comparing and ordering lengths in cm" },
        { "id": "P1.ME.1.4", "text": "measuring and drawing a line segment to the nearest cm" }
      ]
    },
    {
      "id": "P1.ME.2", "level": "P1", "strand": "Measurement and Geometry", "subStrand": "Measurement",
      "name": "Time", "sourcePage": 32,
      "outcomes": [
        { "id": "P1.ME.2.1", "text": "telling time to 5 minutes" },
        { "id": "P1.ME.2.2", "text": "use of ‘am’ and ‘pm’" },
        { "id": "P1.ME.2.3", "text": "use of abbreviations h and min" },
        { "id": "P1.ME.2.4", "text": "duration of one hour/half hour" }
      ]
    },
    {
      "id": "P1.GE.1", "level": "P1", "strand": "Measurement and Geometry", "subStrand": "Geometry",
      "name": "2D Shapes", "sourcePage": 32,
      "outcomes": [
        { "id": "P1.GE.1.1", "text": "identifying, naming, describing and classifying 2D shapes",
          "items": ["rectangle", "square", "triangle", "circle", "half circle", "quarter circle"] },
        { "id": "P1.GE.1.2", "text": "forming different 2D figures with",
          "items": ["rectangle", "square", "triangle", "half circle", "quarter circle"] },
        { "id": "P1.GE.1.3", "text": "identifying the 2D shapes that make up a given figure" },
        { "id": "P1.GE.1.4", "text": "copying figures on dot grid or square grid" }
      ]
    },
    {
      "id": "P1.DR.1", "level": "P1", "strand": "Statistics", "subStrand": "Data Representation and Interpretation",
      "name": "Picture Graphs", "sourcePage": 32,
      "outcomes": [
        { "id": "P1.DR.1.1", "text": "reading and interpreting data from picture graphs" }
      ]
    },

    {
      "id": "P2.WN.1", "level": "P2", "strand": "Number and Algebra", "subStrand": "Whole Numbers",
      "name": "Numbers up to 1000", "sourcePage": 33,
      "outcomes": [
        { "id": "P2.WN.1.1", "text": "counting in tens/hundreds" },
        { "id": "P2.WN.1.2", "text": "number notation, representations and place values (hundreds, tens, ones)" },
        { "id": "P2.WN.1.3", "text": "reading and writing numbers in numerals and in words" },
        { "id": "P2.WN.1.4", "text": "comparing and ordering numbers" },
        { "id": "P2.WN.1.5", "text": "patterns in number sequences" },
        { "id": "P2.WN.1.6", "text": "odd and even numbers" }
      ]
    },
    {
      "id": "P2.WN.2", "level": "P2", "strand": "Number and Algebra", "subStrand": "Whole Numbers",
      "name": "Addition and Subtraction", "sourcePage": 33,
      "outcomes": [
        { "id": "P2.WN.2.1", "text": "addition and subtraction algorithms (up to 3 digits)" },
        { "id": "P2.WN.2.2", "text": "mental calculation involving addition and subtraction of a 3-digit number and ones/tens/hundreds" }
      ]
    },
    {
      "id": "P2.WN.3", "level": "P2", "strand": "Number and Algebra", "subStrand": "Whole Numbers",
      "name": "Multiplication and Division", "sourcePage": 33,
      "outcomes": [
        { "id": "P2.WN.3.1", "text": "multiplication tables of 2, 3, 4, 5 and 10" },
        { "id": "P2.WN.3.2", "text": "use of ÷" },
        { "id": "P2.WN.3.3", "text": "relationship between multiplication and division" },
        { "id": "P2.WN.3.4", "text": "multiplying and dividing within the multiplication tables" },
        { "id": "P2.WN.3.5", "text": "mental calculation involving multiplication and division within multiplication tables of 2, 3, 4, 5 and 10" }
      ]
    },
    {
      "id": "P2.FR.1", "level": "P2", "strand": "Number and Algebra", "subStrand": "Fractions",
      "name": "Fraction of a Whole", "sourcePage": 33,
      "outcomes": [
        { "id": "P2.FR.1.1", "text": "fraction as part of a whole" },
        { "id": "P2.FR.1.2", "text": "notation and representations of fractions" },
        { "id": "P2.FR.1.3", "text": "comparing and ordering fractions with denominators of given fractions not exceeding 12",
          "items": ["unit fractions", "like fractions"] }
      ]
    },
    {
      "id": "P2.FR.2", "level": "P2", "strand": "Number and Algebra", "subStrand": "Fractions",
      "name": "Addition and Subtraction", "sourcePage": 33,
      "outcomes": [
        { "id": "P2.FR.2.1", "text": "adding and subtracting like fractions within one whole with denominators of given fractions not exceeding 12" }
      ]
    },
    {
      "id": "P2.MO.1", "level": "P2", "strand": "Number and Algebra", "subStrand": "Money",
      "name": "Money", "sourcePage": 33,
      "outcomes": [
        { "id": "P2.MO.1.1", "text": "counting amount of money in dollars and cents" },
        { "id": "P2.MO.1.2", "text": "reading and writing money in decimal notation" },
        { "id": "P2.MO.1.3", "text": "comparing two or three amounts of money" },
        { "id": "P2.MO.1.4", "text": "converting an amount of money in decimal notation to cents only, and vice versa" }
      ]
    },
    {
      "id": "P2.ME.1", "level": "P2", "strand": "Measurement and Geometry", "subStrand": "Measurement",
      "name": "Length, Mass and Volume", "sourcePage": 34,
      "outcomes": [
        { "id": "P2.ME.1.1", "text": "measuring", "items": ["length in metres", "mass in kilograms/grams", "volume of liquid in litres"] },
        { "id": "P2.ME.1.2", "text": "using appropriate units of measurement and their abbreviations m, g, kg, ℓ" },
        { "id": "P2.ME.1.3", "text": "comparing and ordering", "items": ["lengths", "masses", "volumes"] }
      ]
    },
    {
      "id": "P2.ME.2", "level": "P2", "strand": "Measurement and Geometry", "subStrand": "Measurement",
      "name": "Time", "sourcePage": 34,
      "outcomes": [
        { "id": "P2.ME.2.1", "text": "telling time to the minute" },
        { "id": "P2.ME.2.2", "text": "measuring time in hours and minutes" },
        { "id": "P2.ME.2.3", "text": "converting time in hours and minutes to minutes only, and vice versa" }
      ]
    },
    {
      "id": "P2.GE.1", "level": "P2", "strand": "Measurement and Geometry", "subStrand": "Geometry",
      "name": "2D Shapes", "sourcePage": 34,
      "outcomes": [
        { "id": "P2.GE.1.1", "text": "making/completing patterns with 2D shapes according to one or two of the following attributes",
          "items": ["size", "shape", "colour", "orientation"] }
      ]
    },
    {
      "id": "P2.GE.2", "level": "P2", "strand": "Measurement and Geometry", "subStrand": "Geometry",
      "name": "3D Shapes", "sourcePage": 34,
      "outcomes": [